{
  "$schema": "https://json-schema.org/draft/2020-12/schema",
  "$id": "https://github.com/zenchron-dynamics/zenchron-foundry/schemas/post-build-authorization-v1.schema.json",
  "title": "Post-build authorization record, v1",
  "description": "The verdict of the post-build authorization gate. It states that a SPECIFIC set of staged platform child manifests, produced by ONE workflow run from ONE source revision and scanned against ONE frozen vulnerability database snapshot, are eligible to become inputs to an immutable release-candidate manifest. It authorizes NOTHING ELSE. In particular it is not a statement that the images may be published publicly, that they are stable-release approved, that they carry a release signature, that the architecture set is complete, or that any other run, revision, digest or database snapshot is covered. `authorization_scope` is an enum with exactly one member for that reason: a generic boolean such as {\"authorized\": true} invites a later consumer to read whatever authorization it happens to need into a record that never proved it.",
  "type": "object",
  "additionalProperties": false,
  "required": [
    "schema_version",
    "repository",
    "source_revision",
    "workflow_run_id",
    "workflow_run_attempt",
    "workflow_ref",
    "generated_at",
    "build_created",
    "trivy_db_snapshot",
    "staging_package",
    "expected_matrix",
    "children",
    "authorization_scope",
    "public_exposure_authorized",
    "verdict"
  ],
  "properties": {
    "schema_version": {
      "const": 1
    },
    "repository": {
      "type": "string",
      "pattern": "^[A-Za-z0-9._-]+/[A-Za-z0-9._-]+$",
      "description": "owner/repo that produced this record. A consumer must refuse a record from another repository."
    },
    "source_revision": {
      "type": "string",
      "pattern": "^[0-9a-f]{40}$",
      "description": "Full source revision the children were built from. Every child's evidence must agree with this."
    },
    "workflow_run_id": {
      "type": "integer",
      "minimum": 1
    },
    "workflow_run_attempt": {
      "type": "integer",
      "minimum": 1
    },
    "workflow_ref": {
      "const": "zenchron-dynamics/zenchron-foundry/.github/workflows/stage-and-authorize.yml@refs/heads/master",
      "description": "The canonical producing workflow, pinned. Recording whatever the caller happened to be run as would let a branch copy of this workflow emit a record that looks authoritative. A consumer must STILL verify the run through the GitHub API: this field says what the record claims, and an in-record constant cannot prove itself."
    },
    "generated_at": {
      "type": "string",
      "pattern": "^[0-9]{4}-[0-9]{2}-[0-9]{2}T[0-9]{2}:[0-9]{2}:[0-9]{2}Z$"
    },
    "trivy_db_snapshot": {
      "type": "object",
      "additionalProperties": false,
      "required": [
        "identity",
        "frozen"
      ],
      "description": "The ONE vulnerability database snapshot every child was evaluated against. Ten jobs each resolving their own database would let a single record combine findings judged against different knowledge states, so the aggregate requires every child to report this identity verbatim.",
      "properties": {
        "identity": {
          "type": "string",
          "minLength": 1,
          "description": "Canonical snapshot identity (database digest plus its recorded update time)."
        },
        "frozen": {
          "const": true,
          "description": "Always true. A record whose database was not frozen for the run cannot be authorized."
        }
      }
    },
    "staging_package": {
      "type": "string",
      "pattern": "^ghcr\\.io/[a-z0-9._-]+/[a-z0-9._-]+$",
      "description": "The private quarantine package every child was pushed to. Children referencing any other package are refused."
    },
    "expected_matrix": {
      "type": "object",
      "additionalProperties": false,
      "required": [
        "images",
        "platforms",
        "expected_children"
      ],
      "description": "The COMPLETE set of children this record claims to cover, declared before evaluation. Completeness is checked against this rather than against whatever happened to be collected, so a silently missing job cannot produce a smaller passing record.",
      "properties": {
        "images": {
          "type": "integer",
          "minimum": 1
        },
        "platforms": {
          "type": "array",
          "minItems": 1,
          "uniqueItems": true,
          "items": {
            "type": "string",
            "pattern": "^linux/(amd64|arm64)$"
          }
        },
        "expected_children": {
          "type": "integer",
          "minimum": 1
        }
      }
    },
    "children": {
      "type": "array",
      "minItems": 1,
      "items": {
        "$ref": "#/$defs/child"
      }
    },
    "authorization_scope": {
      "const": "immutable-rc-manifest-input",
      "description": "The ONLY scope this record can carry. It means: these exact staged child digests are eligible to become inputs to an immutable release-candidate manifest. It does not mean publicly publishable, stable-release approved, release-signed, architecture-complete, or applicable to any other run, revision, digest or database snapshot."
    },
    "public_exposure_authorized": {
      "const": false,
      "description": "Always false in v1. Public exposure is authorized by a separate protected path, never by this gate. Encoded as a const so a record asserting otherwise fails schema validation rather than being interpreted."
    },
    "verdict": {
      "enum": [
        "PASS",
        "FAIL"
      ]
    },
    "refusals": {
      "type": "array",
      "items": {
        "type": "string",
        "minLength": 1
      },
      "description": "Every reason the verdict is FAIL. Present and non-empty whenever verdict is FAIL."
    },
    "build_created": {
      "type": "string",
      "pattern": "^[0-9]{4}-[0-9]{2}-[0-9]{2}T[0-9]{2}:[0-9]{2}:[0-9]{2}Z$",
      "description": "The org.opencontainers.image.created value every child was built with, frozen once for the run. Repository metadata such as updated_at is not evidence of when these images were built."
    }
  },
  "$defs": {
    "child": {
      "type": "object",
      "additionalProperties": false,
      "required": [
        "image_label",
        "platform",
        "staging_tag",
        "digest_reference",
        "manifest_digest",
        "manifest_media_type",
        "tag_resolved_digest",
        "visibility",
        "config_architecture",
        "trivy_db_identity",
        "source_revision",
        "workflow_run_id",
        "workflow_run_attempt",
        "repository",
        "smoke_test",
        "scan",
        "reconciliation",
        "metadata_contract",
        "evidence_sha256"
      ],
      "properties": {
        "image_label": {
          "type": "string",
          "pattern": "^[a-z0-9-]+/(prod|[0-9]+\\.[0-9]+)$",
          "description": "Canonical image identity, e.g. php-fpm/8.3 or nginx/prod."
        },
        "platform": {
          "type": "string",
          "pattern": "^linux/(amd64|arm64)$"
        },
        "staging_tag": {
          "type": "string",
          "minLength": 1
        },
        "digest_reference": {
          "type": "string",
          "pattern": "^ghcr\\.io/[a-z0-9._-]+/[a-z0-9._-]+@sha256:[0-9a-f]{64}$",
          "description": "Immutable by-digest reference. A tag-only reference is refused: a tag is mutable and cannot identify what was evaluated."
        },
        "manifest_digest": {
          "type": "string",
          "pattern": "^sha256:[0-9a-f]{64}$"
        },
        "tag_resolved_digest": {
          "type": "string",
          "pattern": "^sha256:[0-9a-f]{64}$",
          "description": "The digest the registry serves for staging_tag, resolved independently. Must equal manifest_digest; a local build record is not registry evidence."
        },
        "visibility": {
          "const": "private"
        },
        "config_architecture": {
          "type": "string",
          "pattern": "^(amd64|arm64)$",
          "description": "Architecture read from the pushed image config. Must agree with `platform`; a child labelled one way and built another is refused."
        },
        "trivy_db_identity": {
          "type": "string",
          "minLength": 1
        },
        "source_revision": {
          "type": "string",
          "pattern": "^[0-9a-f]{40}$"
        },
        "workflow_run_id": {
          "type": "integer",
          "minimum": 1
        },
        "workflow_run_attempt": {
          "type": "integer",
          "minimum": 1
        },
        "repository": {
          "type": "string",
          "pattern": "^[A-Za-z0-9._-]+/[A-Za-z0-9._-]+$"
        },
        "smoke_test": {
          "enum": [
            "PASS",
            "FAIL"
          ]
        },
        "scan": {
          "enum": [
            "PASS",
            "FAIL"
          ]
        },
        "reconciliation": {
          "enum": [
            "PASS",
            "FAIL"
          ]
        },
        "metadata_contract": {
          "enum": [
            "PASS",
            "FAIL"
          ]
        },
        "evidence_sha256": {
          "type": "string",
          "pattern": "^[0-9a-f]{64}$",
          "description": "Checksum of this child's evidence directory, recomputed by the authorizer from the copied evidence rather than trusted as reported. A well-formed but incorrect value is refused."
        },
        "manifest_media_type": {
          "enum": [
            "application/vnd.oci.image.manifest.v1+json",
            "application/vnd.docker.distribution.manifest.v2+json"
          ],
          "description": "Read from the registry object itself. An index digest is REFUSED: an index can still be pulled with --platform, inspected and scanned, so every downstream check would pass while the record described the wrong object. Disabling sbom/provenance makes an index unlikely, not impossible."
        },
        "oci_labels_sha256": {
          "type": "string",
          "pattern": "^[0-9a-f]{64}$",
          "description": "Checksum of the inspected OCI label map recorded for this child (#126)."
        }
      }
    }
  },
  "allOf": [
    {
      "if": {
        "properties": {
          "verdict": {
            "const": "PASS"
          }
        },
        "required": [
          "verdict"
        ]
      },
      "then": {
        "description": "A PASS verdict cannot coexist with a failed child gate. Previously the verdict enum and the child gate enums were independent, so a record could assert PASS while carrying children whose smoke, scan, reconciliation and metadata all read FAIL.",
        "properties": {
          "children": {
            "items": {
              "properties": {
                "smoke_test": {
                  "const": "PASS"
                },
                "scan": {
                  "const": "PASS"
                },
                "reconciliation": {
                  "const": "PASS"
                },
                "metadata_contract": {
                  "const": "PASS"
                }
              }
            }
          },
          "refusals": {
            "maxItems": 0
          }
        }
      }
    },
    {
      "if": {
        "properties": {
          "verdict": {
            "const": "FAIL"
          }
        },
        "required": [
          "verdict"
        ]
      },
      "then": {
        "description": "A FAIL verdict must say why. The prose said refusals were present on FAIL; nothing required it.",
        "required": [
          "refusals"
        ],
        "properties": {
          "refusals": {
            "minItems": 1
          }
        }
      }
    }
  ]
}
