{
  "schema_version": 1,
  "repository": "zenchron-dynamics/zenchron-foundry",
  "source_revision": "47609df75736a5860651be98177cfe8f9388f496",
  "workflow_run_id": 31792482449,
  "workflow_run_attempt": 1,
  "workflow_ref": "zenchron-dynamics/zenchron-foundry/.github/workflows/stage-and-authorize.yml@refs/heads/master",
  "generated_at": "2026-08-14T11:21:08Z",
  "build_created": "2026-08-14T09:57:27Z",
  "trivy_db_snapshot": {
    "identity": "v2+updated:2026-08-14T07:14:31.886440784Z+next:2026-08-15T07:14:31.886440524Z",
    "frozen": true
  },
  "staging_package": "ghcr.io/zenchron-dynamics/foundry-staging",
  "expected_matrix": {
    "images": 10,
    "platforms": [
      "linux/amd64"
    ],
    "expected_children": 10
  },
  "children": [
    {
      "image_label": "caddy/prod",
      "platform": "linux/amd64",
      "staging_tag": "caddy-prod-r31792482449-a1-s47609df-amd64",
      "digest_reference": "ghcr.io/zenchron-dynamics/foundry-staging@sha256:9f0632b2303dcd3c8a99a268beec8c76cf861fb453beb7e541369e65cec2f3b3",
      "manifest_digest": "sha256:9f0632b2303dcd3c8a99a268beec8c76cf861fb453beb7e541369e65cec2f3b3",
      "manifest_media_type": "application/vnd.oci.image.manifest.v1+json",
      "tag_resolved_digest": "sha256:9f0632b2303dcd3c8a99a268beec8c76cf861fb453beb7e541369e65cec2f3b3",
      "visibility": "private",
      "config_architecture": "amd64",
      "trivy_db_identity": "v2+updated:2026-08-14T07:14:31.886440784Z+next:2026-08-15T07:14:31.886440524Z",
      "source_revision": "47609df75736a5860651be98177cfe8f9388f496",
      "workflow_run_id": 31792482449,
      "workflow_run_attempt": 1,
      "repository": "zenchron-dynamics/zenchron-foundry",
      "smoke_test": "PASS",
      "scan": "PASS",
      "reconciliation": "PASS",
      "metadata_contract": "PASS",
      "evidence_sha256": "1c4ee474193613ed8a02c223b8a98964e5cfa9dca50f2ba5e03853d52cddfe49"
    },
    {
      "image_label": "nginx/prod",
      "platform": "linux/amd64",
      "staging_tag": "nginx-prod-r31792482449-a1-s47609df-amd64",
      "digest_reference": "ghcr.io/zenchron-dynamics/foundry-staging@sha256:29c937f4a5d7e057997e080dc33f252cc69f2529dcb84b0c9d384bf3071713e5",
      "manifest_digest": "sha256:29c937f4a5d7e057997e080dc33f252cc69f2529dcb84b0c9d384bf3071713e5",
      "manifest_media_type": "application/vnd.oci.image.manifest.v1+json",
      "tag_resolved_digest": "sha256:29c937f4a5d7e057997e080dc33f252cc69f2529dcb84b0c9d384bf3071713e5",
      "visibility": "private",
      "config_architecture": "amd64",
      "trivy_db_identity": "v2+updated:2026-08-14T07:14:31.886440784Z+next:2026-08-15T07:14:31.886440524Z",
      "source_revision": "47609df75736a5860651be98177cfe8f9388f496",
      "workflow_run_id": 31792482449,
      "workflow_run_attempt": 1,
      "repository": "zenchron-dynamics/zenchron-foundry",
      "smoke_test": "PASS",
      "scan": "PASS",
      "reconciliation": "PASS",
      "metadata_contract": "PASS",
      "evidence_sha256": "9137ef39cb15befaffb11d9e496b32120c9f9b2ebe5f2622458dfaae6e4b6c0d"
    },
    {
      "image_label": "php-cli/8.3",
      "platform": "linux/amd64",
      "staging_tag": "php-cli-8.3-r31792482449-a1-s47609df-amd64",
      "digest_reference": "ghcr.io/zenchron-dynamics/foundry-staging@sha256:a5baf4528df213a75056dfaba04e17c8029474106aa5fb9f1425092c77599e6d",
      "manifest_digest": "sha256:a5baf4528df213a75056dfaba04e17c8029474106aa5fb9f1425092c77599e6d",
      "manifest_media_type": "application/vnd.oci.image.manifest.v1+json",
      "tag_resolved_digest": "sha256:a5baf4528df213a75056dfaba04e17c8029474106aa5fb9f1425092c77599e6d",
      "visibility": "private",
      "config_architecture": "amd64",
      "trivy_db_identity": "v2+updated:2026-08-14T07:14:31.886440784Z+next:2026-08-15T07:14:31.886440524Z",
      "source_revision": "47609df75736a5860651be98177cfe8f9388f496",
      "workflow_run_id": 31792482449,
      "workflow_run_attempt": 1,
      "repository": "zenchron-dynamics/zenchron-foundry",
      "smoke_test": "PASS",
      "scan": "PASS",
      "reconciliation": "PASS",
      "metadata_contract": "PASS",
      "evidence_sha256": "87c04ddcf14f7688a19b486b7dec7799e86f6b1abb8b55868f06df1ef900b4de"
    },
    {
      "image_label": "php-cli/8.4",
      "platform": "linux/amd64",
      "staging_tag": "php-cli-8.4-r31792482449-a1-s47609df-amd64",
      "digest_reference": "ghcr.io/zenchron-dynamics/foundry-staging@sha256:e63be88286ba90b7a5240a3c6b08a58b3def2aa10b1fe52fbe2f06ecbceed91e",
      "manifest_digest": "sha256:e63be88286ba90b7a5240a3c6b08a58b3def2aa10b1fe52fbe2f06ecbceed91e",
      "manifest_media_type": "application/vnd.oci.image.manifest.v1+json",
      "tag_resolved_digest": "sha256:e63be88286ba90b7a5240a3c6b08a58b3def2aa10b1fe52fbe2f06ecbceed91e",
      "visibility": "private",
      "config_architecture": "amd64",
      "trivy_db_identity": "v2+updated:2026-08-14T07:14:31.886440784Z+next:2026-08-15T07:14:31.886440524Z",
      "source_revision": "47609df75736a5860651be98177cfe8f9388f496",
      "workflow_run_id": 31792482449,
      "workflow_run_attempt": 1,
      "repository": "zenchron-dynamics/zenchron-foundry",
      "smoke_test": "PASS",
      "scan": "PASS",
      "reconciliation": "PASS",
      "metadata_contract": "PASS",
      "evidence_sha256": "be6b4247d3e941b8de753c7fd0992a7162278a4f869d21d37985b3ed49361d2c"
    },
    {
      "image_label": "php-fpm/8.3",
      "platform": "linux/amd64",
      "staging_tag": "php-fpm-8.3-r31792482449-a1-s47609df-amd64",
      "digest_reference": "ghcr.io/zenchron-dynamics/foundry-staging@sha256:51671cd771635a7115c039afa977d884354601373546d943046b915e32ff0e40",
      "manifest_digest": "sha256:51671cd771635a7115c039afa977d884354601373546d943046b915e32ff0e40",
      "manifest_media_type": "application/vnd.oci.image.manifest.v1+json",
      "tag_resolved_digest": "sha256:51671cd771635a7115c039afa977d884354601373546d943046b915e32ff0e40",
      "visibility": "private",
      "config_architecture": "amd64",
      "trivy_db_identity": "v2+updated:2026-08-14T07:14:31.886440784Z+next:2026-08-15T07:14:31.886440524Z",
      "source_revision": "47609df75736a5860651be98177cfe8f9388f496",
      "workflow_run_id": 31792482449,
      "workflow_run_attempt": 1,
      "repository": "zenchron-dynamics/zenchron-foundry",
      "smoke_test": "PASS",
      "scan": "PASS",
      "reconciliation": "PASS",
      "metadata_contract": "PASS",
      "evidence_sha256": "14149f537488e03ec04df061d0b4218b06c05747a36da8564f9a0c301c8ed5d8"
    },
    {
      "image_label": "php-fpm/8.4",
      "platform": "linux/amd64",
      "staging_tag": "php-fpm-8.4-r31792482449-a1-s47609df-amd64",
      "digest_reference": "ghcr.io/zenchron-dynamics/foundry-staging@sha256:911f567f3579f5626b2dfbf78ba05d80ff61afdd7a7831fcf4ab939c845831b4",
      "manifest_digest": "sha256:911f567f3579f5626b2dfbf78ba05d80ff61afdd7a7831fcf4ab939c845831b4",
      "manifest_media_type": "application/vnd.oci.image.manifest.v1+json",
      "tag_resolved_digest": "sha256:911f567f3579f5626b2dfbf78ba05d80ff61afdd7a7831fcf4ab939c845831b4",
      "visibility": "private",
      "config_architecture": "amd64",
      "trivy_db_identity": "v2+updated:2026-08-14T07:14:31.886440784Z+next:2026-08-15T07:14:31.886440524Z",
      "source_revision": "47609df75736a5860651be98177cfe8f9388f496",
      "workflow_run_id": 31792482449,
      "workflow_run_attempt": 1,
      "repository": "zenchron-dynamics/zenchron-foundry",
      "smoke_test": "PASS",
      "scan": "PASS",
      "reconciliation": "PASS",
      "metadata_contract": "PASS",
      "evidence_sha256": "d2cfad89d7d6890005cd23d97e248b953e3bede59a1d2b5a09da77501a95136e"
    },
    {
      "image_label": "php-frankenphp/8.3",
      "platform": "linux/amd64",
      "staging_tag": "php-frankenphp-8.3-r31792482449-a1-s47609df-amd64",
      "digest_reference": "ghcr.io/zenchron-dynamics/foundry-staging@sha256:8d96127c16d8f11e43b6d35a743c30e68ee8a7a835b8ec384e4715e2b084fef7",
      "manifest_digest": "sha256:8d96127c16d8f11e43b6d35a743c30e68ee8a7a835b8ec384e4715e2b084fef7",
      "manifest_media_type": "application/vnd.oci.image.manifest.v1+json",
      "tag_resolved_digest": "sha256:8d96127c16d8f11e43b6d35a743c30e68ee8a7a835b8ec384e4715e2b084fef7",
      "visibility": "private",
      "config_architecture": "amd64",
      "trivy_db_identity": "v2+updated:2026-08-14T07:14:31.886440784Z+next:2026-08-15T07:14:31.886440524Z",
      "source_revision": "47609df75736a5860651be98177cfe8f9388f496",
      "workflow_run_id": 31792482449,
      "workflow_run_attempt": 1,
      "repository": "zenchron-dynamics/zenchron-foundry",
      "smoke_test": "PASS",
      "scan": "PASS",
      "reconciliation": "PASS",
      "metadata_contract": "PASS",
      "evidence_sha256": "bff4a8c5e219dc3c7fae176e487cf8289e8707b350e3c5ce0b7b80d24d49ef94"
    },
    {
      "image_label": "php-frankenphp/8.4",
      "platform": "linux/amd64",
      "staging_tag": "php-frankenphp-8.4-r31792482449-a1-s47609df-amd64",
      "digest_reference": "ghcr.io/zenchron-dynamics/foundry-staging@sha256:1ff20f0dd941950df5dd3c4bc4240db049e86d966a9764eabd0c67a247f57314",
      "manifest_digest": "sha256:1ff20f0dd941950df5dd3c4bc4240db049e86d966a9764eabd0c67a247f57314",
      "manifest_media_type": "application/vnd.oci.image.manifest.v1+json",
      "tag_resolved_digest": "sha256:1ff20f0dd941950df5dd3c4bc4240db049e86d966a9764eabd0c67a247f57314",
      "visibility": "private",
      "config_architecture": "amd64",
      "trivy_db_identity": "v2+updated:2026-08-14T07:14:31.886440784Z+next:2026-08-15T07:14:31.886440524Z",
      "source_revision": "47609df75736a5860651be98177cfe8f9388f496",
      "workflow_run_id": 31792482449,
      "workflow_run_attempt": 1,
      "repository": "zenchron-dynamics/zenchron-foundry",
      "smoke_test": "PASS",
      "scan": "PASS",
      "reconciliation": "PASS",
      "metadata_contract": "PASS",